titles,prices
"Lenovo IdeaPad 3 Business Laptop with Backlit Keyboard & Touchscreen, Intel Core i5-1235U 10-core Processor, 15.6"" FHD, 40GB RAM, 1TB SSD, Fingerprint Reader, Windows 11 Pro, WOWPC Recovery USB",$859.
"Dell Inspiron 15 3000 3520 Business Laptop Computer[Windows 11 Pro], 15.6'' FHD Touchscreen, 11th Gen Intel Quad-Core i5-1135G7, 16GB RAM, 1TB PCIe SSD, Numeric Keypad, Wi-Fi, Webcam, HDMI, Black",$493.
"Lenovo Chromebook 15 (15.6"" FHD Display, 4GB RAM, 128GB Storage (64GB eMMC + 64GB SD Card) 2TB Cloud Storage, Intel Celeron), Home & Student Laptop, Webcam, Wi-Fi 6, 10-Hr Long Battery Life, Chrome OS",$169.
"Lenovo Laptop Computer for Home Business Student, 32GB DDR4 RAM, 1TB PCIe SSD, 15.6"", Intel Dual-Core Processor, WiFi 6, Bluetooth, Type-C, HDMI, Abyss Blue, Windows 11 Pro, AZ-XUT Cable",$429.
"NIMO 17.3 Gaming-Laptop Ryzen 9 8945HS (>i9-13900H) 16GB RAM, 1TB SSD, Radeon 780M, PD 100W USB-C 4.0 AI-Enhanced for Copilot VR Ready, Backlit KB Fingerprint Unlock, Gaming Student Office Business",$673.
HP Flagship 15.6 Touchscreen Laptop Computer - w/MS Office Lifetime • Intel 13th Gen Core i3 (Up to 4.5GHz) • HD Touch Display • for Business & Student • AI Copilot • Win 11 Pro (32GB RAM | 1TB SSD),$658.
"15.6'' Laptop Computer, N4020 Processor Laptops with 8GB RAM, 256GB SSD,15.6 inch FHD 1920 * 1080 Display, WIFI5, BT5.0, Windows 11 Pro",$199.
"ASUS 14"" FHD Laptop, Intel Pentium N6000 Processor, 4GB RAM, 224GB Storage(64GB eMMC+160GB Docking Station Set), Intel UHD Graphics, Webcam, Bluetooth, Win 11, Star Black",$229.
"Lenovo Laptop Computer, Intel 10-Core i7-13620H (Beat Ultra 7 255U), 40GB DDR4 RAM, 1TB PCIe SSD, WiFi 6, Bluetooth 5.2, 15.6"" FHD for Business & Home, RJ45, Type-C, HDMI, Windows 11 Pro, Wendbo",$759.
"HP Premium 17.3"" Touchscreen Laptop, 8-Cores Intel Core i3-N305, 32GB RAM, 128GB eMMC + 1TB SSD, Webcam, HDMI, Wi-Fi 6, Windows 11 S, Silver",$614.
"HP 2025 15.6"" Laptop, Intel 13th i3-1315U (Up to 4.5GHz), 15.6"" HD Touchscreen, 64 GB RAM, 2 TB SSD, Wi-Fi 6E, Copilot AI, Intel UHD Graphics, Windows 11 Pro, for Business & Student, w/Accessories",$769.
"HP 255 G10 Laptop for Home or Work, 16GB RAM, 1TB SSD, 15.6"" Full HD, Ryzen 3 7330U (Beat Intel i5-1135G7), HDMI, USB-C, Windows 11 Pro, Business and Fun Ready",$469.
ASUS E410 Intel Celeron N4020 4GB 64GB 14-Inch HD LED Win 10 Laptop (Star Black),$158.
"HP Stream 14"" HD BrightView Laptop, Intel Celeron N4120 Processor, 16GB RAM, 64GB SSD, Intel UHD Graphics, 720p Webcam, WiFi, HDMI, Win 11 S, Silver (Renewed)",$192.
"HP 14"" Student Business Laptop Computer, Intel N150 CPU (Beat i3-1115G4), 16GB DDR4 RAM, 384GB Storage (128GB UFS + 256GB MSD), WiFi 6, BT 5.4, 1-Year Office365, Win11 Pro S, Natural Silver, Bef-ectoy",$325.
"Lenovo Yoga 7i 2-in-1 Laptop, 16"" 2K Touchscreen Display, Core Ultra 7 155U (Up to 4.80 GHz), 16GB DDR5, 1TB PCIe SSD, Wi-Fi 6E, Backlit KB, FP Reader, TB 4, Webcam, Keypad, PDG HDMI, Win 11 Pro",$814.
"NIMO 15.6 IPS-FHD-Laptop, 16GB RAM 1TB SSD Intel Pentium Quad Core N100, Backlit Keyboard Fingerprint (Beat to i3-1115G4 Up to 3.4GHz) Computer for Student-Home WiFi 6 BT5.2 Win 11",$399.
"Dell 15.6"" Laptop Computer for Home and Student, Intel Core Processor (Beat i5-1135G7), 32Gb Ddr4 Ram, 1Tb Pcie Ssd, Business Vostro 120Hz Fhd, WiFi, Bluetooth, Rj45, Hdmi, Windows 11 Pro",$529.
"ASUS TUF Gaming F16 Gaming Laptop, 16” FHD+ 144Hz IPS-Level 16:10 Display, Intel® Core™ 5 210H, NVIDIA® GeForce RTX™ 4050, 16GB DDR5, 512GB PCIe Gen4 SSD, Wi-Fi 6, Win11 Home, FX607VU-SS53","$1,092."
"HP Stream 14"" HD BrightView Laptop, Intel Celeron N4120 Processor, 4GB RAM, 64GB Storage, Intel HD Graphics, 720p Webcam, 1 Year Office 365, Pink, Win 11 S, 32GB Hotface USB Card",$229.
"NIMO 17.3"" IPS FHD-Laptop, Intel 6 Cores i3-1215U 16GB RAM 256GB SSD (Beat Ryzen 5 7520U, Up to 4.4GHz) Computer with 65W GaN Type C Backlit Keyboard Fingerprint, for Home Student and Business Blue",$449.
"Lenovo 2024 IdeaPad 1 Gen 7 Laptop, 15.6"" FHD Touchscreen, Intel Core i3-1215U, 16GB RAM, 1TB SSD, SD Card Reader, HDMI, Webcam, Wi-Fi 6, Windows 11 Home, Grey",$404.
"LENOVO IdeaPad 1 Laptop, 15.6” FHD Display, Intel Celeron N4500 Processor, 20GB RAM, 1TB SSD, SD Card Reader, Numeric Keypad, HDMI, Wi-Fi 6, Windows 11 Home, 1 Year Office 365, Grey",$377.
"Lenovo 15.6"" Business Laptop | 16GB RAM | 1TB Storage (512GB SSD & 512GB External Storage) | AMD Ryzen 5 7520U(Beats i7-1165G7) | USB-C | HDMI | Ethernet Port | Win 11 Pro | w/WOWPC Bundle",$469.
"HP 17.3"" Business Laptop Computer, 10-Core Intel Core i5, Windows 11 Pro Laptop with Microsoft Office Lifetime Suite, PLUSERA Earphones, Black (Intel Core i5, 64GB RAM | 2.2TB Storage)",$899.
"HP 2025 17 Inch Laptop Computer, 17.3 IPS FHD Business Laptop PC, AMD Ryzen 5 6-Core, 64GB RAM 2.5TB Storage (2TB SSD+512GB Docking Set), Windows 11 Pro Lifetime Office, 10-Key Number Pad",$888.
"HP 14"" HD Student Business Laptop, Intel Quad-Core N4120, 16GB RAM, 384GB Storage, (128GB eMMC+256GB SD Card), 1 Year Office 365, Slim Design, Webcam, HDMI, Bluetooth, WiFi, Win 11 S, Silver",$254.
"HP 250 G9 Laptop Computer • Back to School Limited Edition • 32GB RAM • 1TB SSD • Intel Celeron N4500 Processor • 15.6"" Full HD • Fast Wi-Fi 6 • Long Battery Life • Windows 11 Pro • Astroid Silver",$399.
"HP Windows 11 Pro 15 15.6"" FHD Business Laptop Computer,11th Gen Intel Core i5-1135G7, 16GB RAM 512GB SSD, Intel Iris Xe Graphic, Numeric Pad, Long Battery Life, Wi-Fi 5, Bluetooth 4.2, USB, w/Battery",$449.
"HP 15.6"" Touchscreen Laptop, Intel Core i7-1355U(10 cores, Up to 5.0GHz), 32GB RAM, 1TB SSD, FHD Display, Win 11 Pro, Copilot AI, Webcam, WiFi 6, Bluetooth, w/Accessories for Business & Study",$934.
HP 14 Laptop • Back to School Limited Edition with Microsoft 365 • 4-Core Intel CPU • 16GB RAM • 1.6TB Storage (128GB OnBoard + 512GB P500 Portable SSD + 1T OneDrive) • Natural Silver • Win 11,$299.
"HP Laptop Computer for Home and Student, 16GB RAM, 384GB Storage (128GB UFS + 256GB MSD), Office365 1-Year, 14 inch, Intel N150 CPU (Beats N4120), WiFi 6, BT 5.4, Windows 11 Pro S, Rose Gold, Tichang",$369.
"HP 17.3 inch Laptop, FHD Display, Intel Core i5-1334U, 16 GB RAM, 512 GB SSD, Intel Iris Xe Graphics, Windows 11 Home, Natural Silver, 17-cn3399nr",$552.
"Acer Nitro V Gaming Laptop | Intel Core i5-13420H Processor | NVIDIA GeForce RTX 4050 Laptop GPU | 15.6"" FHD IPS 144Hz Display | 8GB DDR5 | 512GB Gen 4 SSD | WiFi 6 | Backlit KB | ANV15-51-51H9",$740.
"ASUS 14"" FHD Laptop Computer, 4-Core Intel Pentium, Windows 11 Pro with Microsoft Office Lifetime Suite, 4GB RAM 576GB Storage (256GB SSD + 256GB Docking Station +64GB eMMC), PLUSERA Earphones, Black",$259.
"Lenovo V15 Business Laptop | 15.6"" FHD Anti-Glare | Intel Core i7-13620H | 24GB RAM | 1TB SSD | HDMI | Numeric Keypad | Webcam | Wi-Fi 6 | Windows 11 Pro | Bundle with Thunderobot Wireless Mouse",$749.
"HP 14"" Student Business Laptop Computer, Intel N150 CPU (Beat i3-1115G4), 16GB DDR4 RAM, 384GB Storage (128GB UFS + 256GB MSD), WiFi 6, BT 5.4, 1-Year Office365, Win11 Pro S, Pale Rose Gold, Bef-ectoy",$359.
"Itel 14 inch Laptop Computer with Intel Celeron N4000 & Intel UHD Graphics 600, 4GB RAM 256GB SSD, Windows, 14-inch Micro-Edge HD Display, Ultra Slim, Long Battery Life, 2.4G/5G WiFi, BT 5.0, HDMI",$139.
"ASUS TUF Gaming A14 Copilot+ PC Gaming Laptop, 14” WQXGA 16:10 165Hz Display, AMD Ryzen™ AI 7 8845HS, NVIDIA® GeForce RTX™ 4050, 16GB LPDDR5X, 512GB PCIe® Gen 4.0 SSD, Wi-Fi 6E, Windows 11 Home","$1,112."
"Lenovo IdeaPad 15.6” FHD Touchscreen Laptop, 40GB RAM 2.5TB Storage (2TB SSD+512GB Docking Station Set), 6-Cores Intel Core i3, Windows 11 Pro with Microsoft Office Included, Plusera Earphones",$599.
"Dell 15.6"" 3530 Laptop Computer for Home & Business Student, Intel 10-Core i5-1334U (Beat i7-1250U), 32GB RAM, 1TB PCIe SSD, 120Hz FHD Vostro Laptop, WiFi, Bluetooth, Black, Windows 11 Pro, AZ-XUT",$679.
"HP 15 inch Laptop for Home or Work, Intel 4-core Processor, 16GB RAM, 256GB SSD, 15.6"" Micro Edge LED IPS Display, SD Card Reader, HDMI, Windows 11 Pro with Microsoft Office 365 Included, WOWPC USB",$499.
"ASUS Vivobook Go 11.6” HD Slim Laptop, Intel Dual Core N4500, Intel Graphics, 4GB, 128GB, Windows 11 Home, SonicMaster, ErgoSense, Black, L210KA-ES04",$231.
